"X","title","abstract"
238,"fair algorithms learning allocation problems"," settings lending policing can modeled centralized agent allocating scarce resource eg loans police officers amongst several groups order maximize objective eg loans given repaid criminals apprehended often problems fairness also concern one natural notion fairness based general principles equality opportunity asks conditional individual candidate resource question probability actually receiving approximately independent individuals group example lending mean equally creditworthy individuals different racial groups roughly equal chances receiving loan policing mean two individuals committing crime different districts roughly equal chances arrested paper formalize general notion fairness allocation problems investigate algorithmic consequences main technical results include efficient learning algorithm converges optimal fair allocation even allocator know frequency candidates ie creditworthy individuals criminals group algorithm operates censored feedback model number candidates received resource given allocation can observed rather true number candidates group models fact learn creditworthiness individuals give loans learn crimes committed police presence district low application framework algorithm consider predictive policing problem resource allocated group number police officers assigned district learning algorithm trained arrest data gathered deployments previous days resulting potential feedback loop algorithm provably overcomes case fairness constraint asks probability individual committed crime arrested independent district live investigate performance learning algorithm philadelphia crime incidents dataset "
239,"fair allocation competitive equilibrium generic incomes"," two food banks catering populations different sizes different needs must divide among donation food items constitutes fair allocation items among competitive equilibrium equal incomes ceei classic solution problem fair efficient allocation goods among equally entitled agents foley varian every agent foodbank receives equal endowment artificial currency purchase bundles goods food items prices goods set high enough agents can simultaneously get favorite withinbudget bundle low enough goods allocated waste ceei satisfies mathematical notions fairness like fairshare also builtin transparency prices can published agents can verify theyre treated equally however ceei guaranteed exist items indivisible study competitive equilibrium generic incomes cegi based idea slightly perturbed endowments enjoys similar fairness efficiency transparency properties ceei show two agents almost equal endowments additive preferences items cegi always exists consider agents priori nonequal like differentsized foodbanks formulate new notion fair allocation among nonequals satisfied cegi show existence cases interest like agents identical preferences experiments simulated spliddit data popular fair division website indicate general existence results open opportunities future research fairness generic endowments fair treatment nonequals "
240," moral framework understanding fair ml economic models equality opportunity"," map recently proposed notions algorithmic fairness economic models equality opportunity eopan extensively studied ideal fairness political philosophy formally show conceptual mapping many existing definition algorithmic fairness predictive value parity equality odds can interpreted special cases eop respect work serves unifying moral framework understanding existing notions algorithmic fairness importantly framework allows us explicitly spell moral assumptions underlying notion fairness interpret recent fairness impossibility results new light last least inspired luck egalitarian models eop propose new family measures algorithmic fairness illustrate proposal empirically show employing measure algorithmic unfairness underlying moral assumptions satisfied can devastating consequences disadvantaged groups welfare "
241,"beyond open vs closed balancing individual privacy public accountability data sharing"," data sensitive open analysis repurposing typically remains closed proprietary information dichotomy undermines efforts make algorithmic systems fair transparent accountable access proprietary data particular needed government agencies enforce policy researchers evaluate methods public hold agencies accountable needs must met preserving individual privacy firm competitiveness paper describe integrated legaltechnical approach provided thirdparty publicprivate data trust designed balance competing interests basic membership allows firms agencies enable lowrisk access data compliance reporting core methods research modular data sharing agreements support wide array projects use cases unless specifically stated otherwise agreement data access initially provided end users customized synthetic datasets offer strong privacy guarantees b removal signals expose competitive advantage c removal biases reinforce discriminatory policies maintaining fidelity original data find using synthetic data conjunction strong legal protections raw data strikes balance transparency proprietorship privacy research objectives legaltechnical framework can form basis data trusts variety contexts "
242,"whos guinea pig investigating online abn tests inthewild"," abn testing adopted many technology companies datadriven approach product design optimization tests often run websites without explicit consent users paper investigate online abn tests using optimizely lens first provide measurement results websites use optimizely drawn alexa topm analyze distributions audiences experiments use three case studies discuss potential ethical pitfalls experiments including involvement political content price discrimination advertising campaigns conclude suggestion greater awareness ethical concerns inherent human experimentation call increased transparency among abn test operators "
243,"fairnessaware programming"," increasingly programming tasks involve automating deploying sensitive decisionmaking processes may adverse impacts individuals groups people issue fairness automated decisionmaking thus become major problem attracting interdisciplinary attention work aim make fairness firstclass concern programming specifically propose fairnessaware programming programmers can state fairness expectations natively code runtime system monitor decisionmaking report violations fairness present rich general specification language allows programmer specify range fairness definitions literature well others decisionmaking program executes runtime maintains statistics decisions made incrementally checks whether fairness definitions violated reporting violations developer advantages approach two fold enabling declarative mathematical specifications fairness programming language simplifies process checking fairness programmer write ad hoc code maintaining statistics ii compared existing techniques checking ensuring fairness approach monitors decisionmaking program wild may running distribution unlike dataset classifier trained tested describe implementation proposed methodology library python programming language illustrate use case studies algorithmic fairness literature "
244,"model cards model reporting"," trained machine learning models increasingly used perform highimpact tasks areas law enforcement medicine education employment order clarify intended use cases machine learning models minimize usage contexts well suited recommend released models accompanied documentation detailing performance characteristics paper propose framework call model cards encourage transparent model reporting model cards short documents accompanying trained machine learning models provide benchmarked evaluation variety conditions across different cultural demographic phenotypic groups eg race geographic location sex fitzpatrick skin type intersectional groups eg age race sex fitzpatrick skin type relevant intended application domains model cards also disclose context models intended used details performance evaluation procedures relevant information focus primarily humancentered machine learning models application fields computer vision natural language processing framework can used document trained machine learning model solidify concept provide cards two supervised models one trained detect smiling faces images one trained detect toxic comments text propose model cards step towards responsible democratization machine learning related artificial intelligence technology increasing transparency well artificial intelligence technology works hope work encourages releasing trained machine learning models accompany model releases similar detailed evaluation numbers relevant documentation "
245," social cost strategic classification"," consequential decisionmaking typically incentivizes individuals behave strategically tailoring behavior specifics decision rule long line work therefore sought counteract strategic behavior designing conservative decision boundaries effort increase robustness effects strategic covariate shift show efforts benefit institutional decision maker expense individuals classified introducing notion social burden prove increase institutional utility necessarily leads corresponding increase social burden moreover show negative externalities strategic classification can disproportionately harm disadvantaged groups population results highlight strategyrobustness must weighed considerations social welfare fairness "
246,"downstream effects affirmative action"," study twostage model students admitted college basis entrance exam noisy signal qualifications type students admitted college can hired employer function college grades independently drawn noisy signal type students drawn one two populations might different type distributions assume employer end pipeline rational sense computes posterior distribution student type conditional information available college admissions grades group membership makes decision based posterior expectation study kinds fairness goals can achieved college setting admissions rule grading policy example college might goal guaranteeing equal opportunity across populations probability passing pipeline hired employer independent group membership conditioned type alternately college might goal incentivizing employer group blind hiring rule show goals can achieved college report grades hand show reasonable conditions goals impossible achieve even isolation college uses even minimally informative grading policy "
247,"access populationlevel signaling source inequality"," identify explore differential access populationlevel signaling also known information design source unequal access opportunity populationlevel signaler potentially noisy observations binary type member population based produces signal member decisionmaker infers types signals accepts individuals whose type high expectation assume signaler disadvantaged population reveals observations decisionmaker whereas signaler advantaged population forms signals strategically study expected utility populations measured fraction accepted members well false positive rates fpr false negative rates fnr first show intuitive results fixed environment advantaged population higher expected utility higher fpr lower fnr disadvantaged one despite identical population quality accurate observations improve expected utility advantaged population harming disadvantaged one next explore introduction publiclyobservable signal test score potential intervention main finding natural intervention intended reduce inequality populations utilities may actually exacerbate settings observations test scores noisy "
248," disparate effects strategic manipulation"," consequential decisions informed algorithmic input individuals may feel compelled alter behavior order gain systems approval models agent responsiveness termed strategic manipulation analyze interaction learner agents world agents equally able manipulate features attempt trick published classifier cases real world classification however agents ability adapt algorithm simply function personal interest receiving positive classification bound complex web social factors affect ability pursue certain action responses paper adapt models strategic manipulation capture dynamics may arise setting social inequality wherein candidate groups face different costs manipulation find whenever one groups costs higher others learners equilibrium strategy exhibits inequalityreinforcing phenomenon wherein learner erroneously admits members advantaged group erroneously excluding members disadvantaged group also consider effects interventions learner subsidizes members disadvantaged group lowering costs order improve classification performance encounter paradoxical result exist cases providing subsidy improves learners utility actually making candidate groups worseoffeven group receiving subsidy results reveal potentially adverse social ramifications deploying tools attempt evaluate individuals quality agents capacities adaptively respond differ "
249," account accounting algorithms systematic literature review algorithmic accountability"," research algorithms impact proliferates calls scrutinyaccountability algorithms systematic review work done field algorithmic accountability far lacking contribution puts forth systematic review following prisma statement english articles period including collected extracted web science scopus using recursive query design coupled computational methods articles prioritized ordered using affinity mapping resulting core articles presented contribution recursive search strategy made possible look beyond term algorithmic accountability query also included terms closely connected theme eg ethics ai regulation algorithms approach allows perspective just critical algorithm studies interdisciplinary overview drawing material data studies law computer science governance studies structure material bovenss widely accepted definition accountability serves focal point material analyzed five points bovens identified integral accountability arguments actor forum relationship two content criteria account finally consequences may result account review makes three contributions first integration accountability theory algorithmic accountability discussion second crosssectoral overview discussion viewed light accountability theory pays extra attention accountability risks algorithmic systems lastly provides definition algorithmic accountability based accountability theory algorithmic accountability literature "
250,"algorithmic realism expanding boundaries algorithmic thought"," although computer scientists eager help address social problems field faces growing awareness many wellintentioned applications algorithms social contexts led significant harm argue addressing gap fields desire good harmful impacts many interventions requires looking epistemic methodological underpinnings algorithms diagnose dominant mode algorithmic reasoning algorithmic formalism describe formalist orientations lead harmful algorithmic interventions addressing harms requires pursuing new mode algorithmic thinking attentive internal limits algorithms social concerns fall beyond bounds algorithmic formalism understand methodological evolution beyond formalism looks like may achieve turn twentieth century evolution american legal thought legal formalism legal realism drawing lessons legal realism propose new mode algorithmic thinkingalgorithmic realismthat provides tools computer scientists account realities social life algorithmic impacts realist approaches although foolproof will better equip computer scientists reduce algorithmic harms reason well good "
251,"algorithmic accountability public administration gdpr paradox"," eu general data protection regulation gdpr often represented larger life behemoth will fundamentally transform world big data abstracted constituent parts corresponding rights responsibilities exemptions operative scope gdpr can unduly aggrandized reality caters specific policy objectives legislators institutional stakeholders much uncertainty ahead precise implementation gdpr academic policy discussions debating adequacy protections automated decisionmaking gdpr articles right informed automated treatment right access data subject safeguards profiling unfortunately literature date disproportionately focuses impact ai private sector deflects extensive review automated enforcement tools public administration even though gdpr enacts significant safeguards automated decisions deliberate design balance interests data protection growing demand algorithms administrative state order facilitate interagency data flows sensitive data processing fuel predictive power algorithmic enforcement tools gdpr decisively surrenders procedural autonomy member states authorize practices yet due dearth research gdprs stance government deployed algorithms widely known public authorities can benefit broadly worded exemptions restrictions automated decisionmaking even circumvent remedies data subjects national legislation potential public authorities invoke derogations gdpr must contained fundamental guarantees due process judicial review equal treatment paper examines interplay principles within prospect algorithmic decisionmaking public authorities "
252,"closing ai accountability gap defining endtoend framework internal algorithmic auditing"," rising concern societal implications artificial intelligence systems inspired wave academic journalistic literature deployed systems audited harm investigators outside organizations deploying algorithms however remains challenging practitioners identify harmful repercussions systems prior deployment deployed emergent issues can become difficult impossible trace back source paper introduce framework algorithmic auditing supports artificial intelligence system development endtoend applied throughout internal organization development lifecycle stage audit yields set documents together form overall audit report drawing organizations values principles assess fit decisions made throughout process proposed auditing framework intended contribute closing accountability gap development deployment largescale artificial intelligence systems embedding robust process ensure audit integrity "
253,"toward situated interventions algorithmic equity lessons field"," research date aimed fairness accountability transparency algorithmic systems largely focused topics identifying failures current systems technical interventions intended reduce bias computational processes researchers given less attention methods account social political contexts specific situated technical systems points use codeveloping algorithmic accountability interventions communities supports outcomes likely address problems situated context recenter power disparately affected harms algorithmic systems paper report experiences using participatory codesign methods algorithmic accountability project called algorithmic equity toolkit main insights gleaned experiences many meaningful interventions toward equitable algorithmic systems nontechnical ii community organizations derive value localized materials opposed scalable beyond particular policy context iii framing harms around algorithmic bias suggests accurate data solution risk missing deeper questions whether technologies used broadly found communitybased methods important inroads addressing algorithmic harms situated contexts "
254,"explainability fact sheets framework systematic assessment explainable approaches"," explanations machine learning come many forms consensus regarding desired properties yet emerge paper introduce taxonomy set descriptors can used characterise systematically assess explainable systems along five key dimensions functional operational usability safety validation order design comprehensive representative taxonomy associated descriptors surveyed explainable artificial intelligence literature extracting criteria desiderata authors proposed implicitly used research survey includes papers introducing new explainability algorithms see criteria used guide development algorithms evaluated well papers proposing criteria computer science social science perspectives novel framework allows systematically compare contrast explainability approaches just better understand capabilities also identify discrepancies theoretical qualities properties implementations developed operationalisation framework form explainability fact sheets enable researchers practitioners alike quickly grasp capabilities limitations particular explainable method used work sheet taxonomy can guide development new explainability approaches aiding critical evaluation along five proposed dimensions "
255,"multilayered explanations algorithmic impact assessments gdpr"," impact assessments received particular attention sides atlantic tool implementing algorithmic accountability aim paper address data protection impact assessments dpias art european union eus general data protection regulation gdpr link gdprs two approaches algorithmic accountabilityindividual rights systemic governance potentially lead accountable explainable algorithms argue algorithmic explanation understood static statement circular multilayered transparency process based several layers general information algorithm groupbased explanations legal justification individual decisions taken argue impact assessment process plays crucial role connecting internal company heuristics risk mitigation outwardfacing rights forming substance several kinds explanations "
256," hidden assumptions behind counterfactual explanations principal reasons"," counterfactual explanations gaining prominence within technical legal business circles way explain decisions machine learning model explanations share trait longestablished principal reason explanations required us credit laws explain decision highlighting set features deemed relevantand withholding others featurehighlighting explanations several desirable properties place constraints model complexity require model disclosure detail needed different achieve different decision seem automate compliance law far complex subjective appear paper demonstrate utility featurehighlighting explanations relies number easily overlooked assumptions recommended change feature values clearly maps realworld actions features can made commensurate looking distribution training data features relevant decision hand underlying model stable time monotonic limited binary outcomes explore several consequences acknowledging attempting address assumptions including paradox way featurehighlighting explanations aim respect autonomy unchecked power featurehighlighting explanations grant decision makers tension making explanations useful need keep model hidden new research suggests several ways featurehighlighting explanations can work around problems identify disconnect features model actions real worldand subjective choices necessary compensate thismust understood techniques can usefully implemented "
257," model fail contrastive local explanations retail forecasting"," various business settings interest using complex machine learning techniques sales forecasting difficult convince analysts along superiors adopt techniques since models considered black boxes even perform better current models use examine impact contrastive explanations large errors users attitudes towards blackbox model propose algorithm monte carlo bounds reasonable predictions given large error mcbrp determines feature values result reasonable prediction general trends feature target based monte carlo simulations evaluate real dataset real users conducting user study participants determine explanations generated mcbrp help users understand prediction results large error promotes trust automaticallylearned model study shows users able answer objective questions models predictions overall accuracy provided contrastive explanations show users saw mcbrp explanations understand model makes large errors predictions significantly users control group also conduct indepth analysis difference attitudes practitioners researchers confirm results hold conditioning users background "
