"X","title","abstract"
166,"fair influence maximization welfare optimization approach"," several social interventions eg suicide hiv prevention leverage social network information maximize outreach algorithmic influence maximization techniques proposed aid choice influencers peer leaders interventions traditional algorithms influence maximization designed social interventions mind result may disproportionately exclude minority communities benefits intervention motivated research fair influence maximization existing techniques require committing single domainspecific fairness measure makes hard decision maker meaningfully compare notions resulting tradeoffs across different applications address shortcomings extending principles cardinal welfare influence maximization setting underlain complex connections members different communities generalize theory regarding principles show circumstances principles can satisfied welfare function propose family welfare functions governed single inequity aversion parameter allows decision maker study taskdependent tradeoffs fairness total influence effectively trade quantities like influence gap varying parameter use welfare functions fairness notion rule undesirable allocations show resulting optimization problem monotone submodular can solved optimality guarantees finally carry detailed experimental analysis synthetic real social networks high welfare can achieved without sacrificing total influence significantly interestingly can show exists welfare functions empirically satisfy principles "
167,"causal intersectionality fair ranking"," paper propose causal modeling approach intersectional fairness flexible taskspecific method computing intersectionally fair rankings rankings used many contexts ranging web search results college admissions causal inference fair rankings received limited attention additionally growing literature causal fairness directed little attention intersectionality bringing issues together formal causal framework make application intersectionality fair machine learning explicit connected important real world effects domain knowledge transparent technical limitations experimentally evaluate approach real synthetic datasets exploring behaviour different structural assumptions "
168,"fair kmeans clustering"," show popular kmeans clustering algorithm lloyds heuristic used variety scientific data can result outcomes unfavorable subgroups data eg demographic groups biased clusterings can deleterious implications humancentric applications resource allocation present fair kmeans objective algorithm choose cluster centers provide equitable costs different groups algorithm fairlloyd modification lloyds heuristic kmeans inheriting simplicity efficiency stability comparison standard lloyds find benchmark data sets fairlloyd exhibits unbiased performance ensuring groups balanced costs output kclustering incurring negligible increase running time thus making viable fair option wherever kmeans currently used "
169,"probabilistic fair clustering"," clustering problems central decisionmaker given complete metric graph vertices must provide clustering vertices minimizes objective function fair clustering problems vertices endowed color eg membership group features valid clustering might also include representation colors clustering prior work fair clustering assumes complete knowledge group membership paper generalize prior work assuming imperfect knowledge group membership probabilistic assignments present clustering algorithms general setting approximation ratio guarantees also address problem metric membership different groups notion order distance experiments conducted using proposed algorithms well baselines validate approach also surface nuanced concerns group membership known deterministically "
170,"verifying individual fairness machine learning models"," consider problem whether given decision model working structured data individual fairness following work dwork model individually biased unfair pair valid inputs close according appropriate metric treated differently model different class label large difference output unbiased fair pair exists objective construct verifiers proving individual fairness given model considering appropriate relaxations problem construct verifiers sound complete linear classifiers kernelized polynomialradial basis function classifiers also report experimental results evaluating proposed algorithms publicly available datasets "
171,"machine learning pipelines provenance reproducibility fair data principles"," machine learning ml increasingly important scientific tool supporting decision making knowledge generation numerous fields also becomes important results ml experiments reproducible unfortunately often case rather ml similar many disciplines faces reproducibility crisis paper describe goals initial steps supporting endtoend reproducibility ml pipelines investigate factors beyond availability source code datasets influence reproducibility ml experiments propose ways apply fair data practices ml workflows present preliminary results role tool provbook capturing comparing provenance ml experiments reproducibility using jupyter notebooks "
172," framework fairness twosided marketplaces"," many interesting problems internet industry can framed twosided marketplace problem examples include search applications recommender systems showing people jobs movies products restaurants etc incorporating fairness building systems crucial can deep social economic impact applications include job recommendations recruiters searching candidates etc paper propose definition develop endtoend framework achieving fairness building machine learning systems scale extend prior work develop optimization framework can tackle fairness constraints source destination sides marketplace well dynamic aspects problem framework flexible enough adapt different definitions fairness can implemented largescale settings perform simulations show efficacy approach "
173," applicability ml fairness notions"," mlbased predictive systems increasingly used support decisions critical impact individuals lives college admission job hiring child custody criminal risk assessment etc result fairness emerged important requirement guarantee predictive systems discriminate specific individuals entire subpopulations particular minorities given inherent subjectivity viewing concept fairness several notions fairness introduced literature paper survey fairness notions unlike surveys literature addresses question notion fairness suited given realworld scenario attempt answer question consists identifying set fairnessrelated characteristics realworld scenario hand analyzing behavior fairness notion fitting two elements recommend suitable fairness notion every specific setup results summarized decision diagram can used practitioners policy makers navigate relatively large catalogue fairness notions "
174,"fairness machine learning false positive rate equality measure fairness"," machine learning informs increasingly consequential decisions different metrics proposed measuring algorithmic bias unfairness two popular fairness measures calibration equality false positive rate measure seems intuitively important notably usually impossible satisfy measures reason large literature machine learning speaks fairness tradeoff two measures framing assumes measures fact capturing something important date philosophers examined crucial assumption examined extent measure actually tracks normatively important property makes inevitable statistical conflict calibration false positive rate equality important topic ethics paper give ethical framework thinking measures argue contrary initial appearances false positive rate equality track anything fairness thus sets incoherent standard evaluating fairness algorithms "
175,"algorithmic fairness education"," datadriven predictive models increasingly used education support students instructors administrators however concerns fairness predictions uses algorithmic systems introduction algorithmic fairness education draw parallels prior literature educational access bias discrimination examine core components algorithmic systems measurement model learning action identify sources bias discrimination process developing deploying systems statistical similaritybased causal notions fairness reviewed contrasted way apply educational contexts recommendations policy makers developers educational technology offer guidance promote algorithmic fairness education "
176," causal linear model quantify edge unfairness unfair edge prioritization discrimination removal"," dataset can generated unfair mechanism numerous settings instance judicial system unfair rejects bail plea accused based race mitigate unfairness procedure generating dataset need identify sources unfairness quantify unfairness sources quantify sources affect overall unfairness prioritize sources addressing realworld issues underlying prior work zhang et al identifies removes discrimination data generated suggest methodology mitigate unfairness data generation phase use notion unfair edge chiappa et al source discrimination quantify unfairness along unfair edge also quantify overall unfairness particular decision towards subset sensitive attributes terms edge unfairness measure sensitivity former latter varied using formulation cumulative unfairness terms edge unfairness alter discrimination removal methodology discussed zhang et al formulating optimization problem helps getting rid constraints grow exponentially number sensitive attributes values taken finally discuss priority algorithm policymakers address realworld issues underlying edges result unfairness experimental section validates linear model assumption made quantify edge unfairness "
177," impossibility theorem machine fairness causal perspective"," increasing pervasive use machine learning social economic settings interest notion machine bias ai community models trained historic data reflect biases exist society propagated future decisions recent study conducted propublica revealed compas recidivism prediction tool biased africanamerican community three prominent metrics fairness used community statistically proved impossible satisfy time led ambiguity definition fairness report causal perspective impossibility theorem fairness presented along causal goal machine fairness "
178,"fair algorithms multiagent multiarmed bandits"," propose multiagent variant classical multiarmed bandit problem n agents k arms pulling arm generates possibly different stochastic reward agent unlike classical multiarmed bandit problem goal learn best arm agent may perceive different arm best instead seek learn fair distribution arms drawing long line research economics computer science use nash social welfare notion fairness design multiagent variants three classic multiarmed bandit algorithms show achieve sublinear regret now measured terms nash social welfare "
179,"algorithmic stability fair allocation indivisible goods among two agents"," propose notion algorithmic stability scenarios cardinal preferences elicited informally definition captures idea agent experience large change utility long make small innocuous mistakes reporting preferences study notion context fair efficient allocations indivisible goods among two agents show impossible achieve exact stability along even weak notion fairness even approximate efficiency result propose two relaxations stability namely approximatestability weakapproximatestability show existing algorithms fair division literature guarantee fair efficient outcomes perform poorly respect relaxations leads us explore possibility designing new algorithms stable towards end present general characterization result pairwise maximin share allocations turn use design algorithm approximatelystable guarantees pairwise maximin share pareto optimal allocation two agents finally present simple framework can used modify existing fair efficient algorithms order ensure also achieve weakapproximatestability "
180,"fairnessaware online personalization"," decision making crucial applications lending hiring college admissions witnessed increasing use algorithmic models techniques result confluence factors ubiquitous connectivity ability collect aggregate process large amounts finegrained data using cloud computing ease access applying sophisticated machine learning models quite often applications powered search recommendation systems turn make use personalized ranking algorithms time increasing awareness ethical legal challenges posed use datadriven systems researchers practitioners different disciplines recently highlighted potential systems discriminate certain population groups due biases datasets utilized learning underlying recommendation models present study fairness online personalization settings involving ranking individuals starting fair warmstart machinelearned model first demonstrate online personalization can cause model learn act unfair manner user biased hisher responses purpose construct stylized model generating training data potentially biased features well potentially biased labels quantify extent bias learned model user responds biased manner many realworld scenarios formulate problem learning personalized models fairness constraints present regularization based approach mitigating biases machine learning demonstrate efficacy approach extensive simulations different parameter settings code httpsgithubcomgroshanlalfairnessawareonlinepersonalization "
181,"predictability fairness social sensing"," many applications one may benefit collaborative collection data sensing physical phenomenon known social sensing show make social sensing predictable sense guaranteeing number queries per participant will independent initial state expectation even population participants varies time fair sense guaranteeing number queries per participant will equalised among participants expectation even population participants varies time use case consider large highdensity network participating parked vehicles awoken administrative centre network proceeds search moving missing entities interest using rfidbased techniques regulate number geographical distribution parked vehicles switched thus actively searching moving entity interest seek conserve vehicular energy consumption time maintaining good geographical coverage city moving entity interest likely located within acceptable time frame vehicle participants switched point time determined periodically use stochastic techniques illustrated example missing alzheimers patient melbourne australia "
182,"online task scheduling fog computing multiresource fairness"," fog computing systems one key challenge online task scheduling ie decide resource allocation tasks continuously generated end devices design challenging various uncertainties manifested fog computing systems eg tasks resource demands remain unknown actual arrivals recent works applied deep reinforcement learning drl techniques conduct online task scheduling improve various objectives however overlook multiresource fairness different tasks key achieving fair resource sharing among tasks general nontrivial achieve thusly still open problem design online task scheduling scheme multiresource fairness paper address challenges particularly leveraging drl techniques adopting idea dominant resource fairness drf propose fairts online task scheduling scheme learns directly experience effectively shorten average task slowdown ensuring multiresource fairness among tasks simulation results show fairts outperforms stateoftheart schemes ultralow task slowdown better resource fairness "
183,"machine learning fairness justice systems base rates false positives false negatives"," machine learning best practice statements proliferated lack consensus standards fairness standards particular little guidance fairness might achieved practice specifically fairness errors false negatives false positives can pose problem set weights make unavoidable tradeoffs judge models present different kinds errors across racial groups paper considers consequences higher rates false positives one racial group higher rates false negatives another racial group paper examines different errors justice settings can present problems machine learning applications limits computation resolving tradeoffs solutions might crafted courageous conversations leadership line workers stakeholders impacted communities "
184,"memory networks consumer protectionunfairness exposed"," recent work demonstrated datadriven ai methods can leverage consumer protection supporting automated analysis legal documents however shortcoming datadriven approaches poor explainability posit domain useful explanations classifier outcomes can provided resorting legal rationales thus consider several configurations memoryaugmented neural networks rationales given special role modeling context knowledge results show rationales contribute improve classification accuracy also able offer meaningful natural language explanations otherwise opaque classifier outcomes "
185,"lift scalable framework measuring fairness ml applications"," many internet applications powered machine learned models usually trained labeled datasets obtained either implicit explicit user feedback signals human judgments since societal biases may present generation datasets possible trained models biased thereby resulting potential discrimination harms disadvantaged groups motivated need understanding addressing algorithmic bias webscale ml systems limitations existing fairness toolkits present linkedin fairness toolkit lift framework scalable computation fairness metrics part large ml systems highlight key requirements deployed settings present design fairness measurement system discuss challenges encountered incorporating fairness tools practice lessons learned deployment linkedin finally provide open problems based practical experience "
186,"learning fair policies multiobjective deep reinforcement learning average discounted rewards"," operations autonomous systems generally affect simultaneously several users crucial designs account fairness considerations contrast standard deep reinforcement learning rl investigate problem learning policy treats users equitably paper formulate novel rl problem objective function encodes notion fairness formally define optimized problem provide theoretical discussion examine case discounted rewards average rewards analysis notably derive new result standard rl setting independent interest states novel bound approximation error respect optimal average reward policy optimal discounted reward since learning discounted rewards generally easier discussion justifies finding fair policy average reward learning fair policy discounted reward thus describe several classic deep rl algorithms can adapted fair optimization problem validate approach extensive experiments three different domains "
187,"improving fair predictions using variational inference causal models"," importance algorithmic fairness grows increasing impact machine learning peoples lives recent work fairness metrics shows need causal reasoning fairness constraints work practical method named fairtrade proposed creating flexible prediction models integrate fairness constraints sensitive causal paths method uses recent advances variational inference order account unobserved confounders method outline proposed uses causal mechanism estimates audit black box models experiments conducted simulated data real dataset context detecting unlawful social welfare research aims contribute machine learning techniques honour ethical legal boundaries "
188,"adversarial learning counterfactual fairness"," recent years fairness become important topic machine learning research community particular counterfactual fairness aims building prediction models ensure fairness individual level rather globally considering equity entire population idea imagine individual look like variation given attribute interest different gender race instance existing approaches rely variational autoencoding individuals using maximum mean discrepancy mmd penalization limit statistical dependence inferred representations corresponding sensitive attributes enables simulation counterfactual samples used training target fair model goal produce similar outcomes every alternate version individual work propose rely adversarial neural learning approach enables powerful inference mmd penalties particularly better fitted continuous setting values sensitive attributes exhaustively enumerated experiments show significant improvements term counterfactual fairness discrete continuous settings "
189,"fairxgboost fairnessaware classification xgboost"," highly regulated domains finance long favoured use machine learning algorithms scalable transparent robust yield better performance one prominent examples algorithm xgboost meanwhile also growing interest building fair unbiased models regulated domains numerous biasmitigation algorithms proposed end however biasmitigation methods restricted specific model families logistic regression support vector machine models thus leaving modelers difficult decision choosing fairness biasmitigation algorithms scalability transparency performance algorithms xgboost aim leverage best worlds proposing fair variant xgboost enjoys advantages xgboost also matching levels fairness stateoftheart biasmitigation algorithms furthermore proposed solution requires little terms changes original xgboost library thus making easy adoption provide empirical analysis proposed method standard benchmark datasets used fairness community "
190,"fairness eyes data certifying machinelearning models"," present framework allows certify fairness degree model based interactive privacypreserving test framework verifies trained model regardless training process architecture thus allows us evaluate deep learning model multiple fairness definitions empirically tackle two scenarios either test data privately available tester publicly known advance even model creator investigate soundness proposed approach using theoretical analysis present statistical guarantees interactive test finally provide cryptographic technique automate fairness testing certified inference blackbox access model hand hiding participants sensitive data "
191," general framework fairness multistakeholder recommendations"," contemporary recommender systems act intermediaries multisided platforms serving high utility recommendations sellers buyers systems attempt balance objectives multiple stakeholders including sellers buyers platform difficulty providing recommendations maximize utility buyer simultaneously representing sellers platform lead many interesting research problemstraditionally formulated integer linear programs compute recommendations buyers together emphoffline fashion incorporating coverage constraints individual sellers proportionally represented across recommended items approaches can lead unforeseen biases wherein certain buyers consistently receive low utility recommendations order meet global seller coverage constraints remedy situation propose general formulation incorporates seller coverage objectives alongside individual buyer objectives realtime personalized recommender system addition leverage highly scalable submodular optimization algorithms provide recommendations buyer provable theoretical quality bounds furthermore empirically evaluate efficacy approach using data online realestate marketplace "
192," winner dynamic lotteries multigroup fairnessaware recommendation"," recommender systems designed deployed increasing number sociallyconsequential applications become important consider properties fairness systems exhibit considerable research recommendation fairness however argue previous literature based simple uniform often unidimensional notions fairness assumptions recognize realworld complexities fairnessaware applications paper explicitly represent design decisions enter tradeoff accuracy fairness across multiplydefined intersecting protected groups supporting multiple fairness metrics framework also allows recommender adjust performance based historical view recommendations delivered time horizon dynamically rebalancing fairness concerns within framework formulate lotterybased mechanisms choosing fairness concerns demonstrate performance two recommendation domains "
193," identification fair auditors evaluate recommender systems based novel noncomparative fairness notion"," decisionsupport systems information systems offer support peoples decisions various applications judiciary realestate banking sectors lately support systems found discriminatory context many practical deployments attempt evaluate mitigate biases algorithmic fairness literature nurtured using notions comparative justice relies primarily comparing twomore individuals groups within society supported systems however fairness notion useful identification fair auditors hired evaluate latent biases within decisionsupport systems solution introduce paradigm shift algorithmic fairness via proposing new fairness notion based principle noncomparative justice assuming auditor makes fairness evaluations based potentially unknown desired properties decisionsupport system proposed fairness notion compares systems outcome auditors desired outcome show proposed fairness notion also provides guarantees terms comparative fairness notions proving system can deemed fair perspective comparative fairness eg individual fairness statistical parity noncomparatively fair respect auditor deemed fair respect fairness notions also show converse holds true context individual fairness brief discussion also presented regarding fairness notion can used identify fair reliable auditors can use quantify biases decisionsupport systems "
